{
  "schema": "lintdiff.delta.v1",
  "base_inventory_id": "inventory_id_v1:base",
  "head_inventory_id": "inventory_id_v1:head",
  "source_diff_id": "source_diff_id_v1:0000000000000000000000000000000000000000000000000000000000000000",
  "source_diff_algorithm": "sha256-v1",
  "provenance": {
    "comparability": {"status": "comparable", "reasons": []},
    "contextual_changes": []
  },
  "items": [],
  "summary": {
    "total": 0,
    "unchanged": 0,
    "new": 0,
    "resolved": 0,
    "modified": 0,
    "ambiguous": 0,
    "touched": 0,
    "untouched": 0,
    "no_location": 0,
    "unknown_scope": 0
  },
  "policy": {
    "profile": "advisory",
    "block_new_errors": false,
    "block_new_warnings": false,
    "block_ambiguous": false
  },
  "verdict": {"status": "accepted", "reasons": []}
}
